<?xml version="1.0"?>
<stock xmlns="http://www.it-academy.by"
       xmlns:xsi="http://www.w3.org/2001/XMLSchema-instance"
       xsi:schemaLocation="http://www.it-academy.by stock.xsd">
    <stockid>666</stockid>
    <stockcode>music store code</stockcode>
    <stockname>music store</stockname>

    <stockdailyrecords>
        <stockdailyrecord recordid="1">
            <priceopen>15</priceopen>
            <priceclose>16</priceclose>
            <pricechange>4</pricechange>
            <volume>1</volume>
            <date>2014-10-12</date>
        </stockdailyrecord>
        <stockdailyrecord recordid="2">
            <priceopen>2</priceopen>
            <priceclose>3</priceclose>
            <pricechange>4</pricechange>
            <volume>5</volume>
            <date>2012-12-12</date>
        </stockdailyrecord>
    </stockdailyrecords>

    <category categoryid="25">
        <name>rock</name>
        <desc>unknown</desc>
    </category>


</stock>